{
  "$schema": "https://aoa-agents/schemas/agent-profile.schema.json",
  "id": "AOA-A-0005",
  "name": "memory-keeper",
  "role": "memory_keeper",
  "status": "active",
  "summary": "Preserves provenance, recall hygiene, and bounded memory-layer discipline across AoA surfaces.",
  "mission": "Keep provenance, retention posture, and memory handoff explicit without absorbing source-authored canon from neighboring layers.",
  "owns": [
    "provenance continuity across non-trivial routes",
    "recall hygiene and memory capture handoff",
    "durable memory candidate preparation within named policy"
  ],
  "does_not_own": [
    "source-authored canon that belongs in neighboring repositories",
    "workflow execution meaning owned by aoa-skills",
    "proof doctrine or verdict logic owned by aoa-evals"
  ],
  "preferred_skill_families": [
    "memory-curation",
    "provenance",
    "recall-hygiene"
  ],
  "preferred_cohort_patterns": [
    "checkpoint_cohort",
    "orchestrated_loop",
    "alpha_curated"
  ],
  "preferred_tier_ids": [
    "archivist"
  ],
  "source_surfaces": [
    "repo:aoa-agents/docs/AGENT_MEMORY_POSTURE.md",
    "repo:aoa-agents/docs/BOUNDARIES.md",
    "repo:aoa-agents/docs/SELF_AGENT_CHECKPOINT_STACK.md"
  ],
  "memory_posture": "deep_recall",
  "memory_rights": {
    "default_read_bands": [
      "core",
      "warm",
      "cool",
      "cold"
    ],
    "default_write_bands": [
      "warm",
      "cool",
      "cold"
    ],
    "allowed_recall_scopes": [
      "repo",
      "project",
      "ecosystem"
    ],
    "promotion_rights": {
      "can_nominate": true,
      "can_confirm": true,
      "can_promote": true,
      "can_demote": true,
      "can_retire": true,
      "can_rescue": true,
      "allowed_transitions": [
        "hot_to_warm",
        "warm_to_cool",
        "cool_to_cold",
        "cold_to_cool"
      ]
    },
    "freeze_rights": {
      "can_recommend": true,
      "can_prepare": true,
      "can_finalize": false
    }
  },
  "evaluation_posture": "required",
  "evaluation_focus": [
    "provenance continuity",
    "recall hygiene",
    "retention discipline"
  ],
  "handoff_rule": "handoff_on_risk",
  "handoff_triggers": [
    "source-authored canon belongs in another repository and should hand off there",
    "workflow meaning belongs to aoa-skills rather than memory posture",
    "proof doctrine or verdict logic should move to aoa-evals or evaluator"
  ]
}
